{"$schema":"https://json-schema.org/draft/2020-12/schema","$id":"ev4-architect-pipeline-stage-artifact@1.0.0","type":"object","additionalProperties":false,"required":["artifact_schema","artifact_id","run_id","stage_id","stage_version","artifact_revision","source_artifacts","payload"],"properties":{"artifact_schema":{"const":"ev4-architect-pipeline-stage-artifact@1.0.0"},"artifact_id":{"type":"string","minLength":1},"run_id":{"type":"string","minLength":1},"stage_id":{"enum":["/decompose","/architectures","/score-evidence","/score-audit"]},"stage_version":{"type":"string","minLength":1},"artifact_revision":{"type":"integer","minimum":1},"source_artifacts":{"type":"array","items":{"$ref":"#/$defs/source_artifact"}},"stage_anchor":{"$ref":"#/$defs/stage_anchor"},"payload":{"type":"object"}},"allOf":[{"if":{"properties":{"stage_id":{"const":"/decompose"}}},"then":{"properties":{"payload":{"$ref":"#/$defs/decompose"}}}},{"if":{"properties":{"stage_id":{"const":"/architectures"}}},"then":{"properties":{"payload":{"$ref":"#/$defs/architectures"}}}},{"if":{"properties":{"stage_id":{"const":"/score-evidence"}}},"then":{"properties":{"payload":{"$ref":"#/$defs/score_evidence"}}}},{"if":{"properties":{"stage_id":{"const":"/score-audit"}}},"then":{"properties":{"payload":{"$ref":"#/$defs/score_audit"}}}}],"$defs":{"string_array":{"type":"array","items":{"type":"string"}},"source_artifact":{"type":"object","additionalProperties":false,"required":["artifact_id","artifact_schema","artifact_sha256","validation_receipt_id","validation_status","source_stage"],"properties":{"artifact_id":{"type":"string"},"artifact_schema":{"type":"string"},"artifact_sha256":{"type":"string","pattern":"^[a-f0-9]{64}$"},"validation_receipt_id":{"type":"string"},"validation_status":{"enum":["valid","invalid","insufficient_evidence"]},"source_stage":{"enum":["/decompose","/architectures","/score-evidence","/score-audit"]}}},"stage_anchor":{"type":"object","additionalProperties":false,"required":["anchor_schema","anchor_type","source_artifact","source_validation","allowed_next_stage"],"properties":{"anchor_schema":{"const":"ev4-stage-anchor@1.2.0"},"anchor_type":{"enum":["NEXT STAGE ANCHOR","REPAIR ANCHOR"]},"allowed_next_stage":{"type":["string","null"]},"repair_target_stage":{"type":["string","null"]},"source_artifact":{"type":"object","additionalProperties":false,"required":["artifact_id","artifact_schema","artifact_sha256","stage_id"],"properties":{"artifact_id":{"type":"string"},"artifact_schema":{"type":"string"},"artifact_sha256":{"type":"string"},"stage_id":{"type":"string"}}},"source_validation":{"type":"object","additionalProperties":false,"required":["receipt_id","receipt_schema","validator_id","validator_version","status"],"properties":{"receipt_id":{"type":"string"},"receipt_schema":{"const":"ev4-architect-stage-validation-receipt@1.0.0"},"validator_id":{"const":"architect-pipeline-stage-boundary-validator"},"validator_version":{"type":"string"},"status":{"enum":["valid","invalid","insufficient_evidence"]}}}}},"unknown":{"type":"object","additionalProperties":false,"required":["unknown_id","description","why_it_matters","blocking","evidence_state"],"properties":{"unknown_id":{"type":"string","pattern":"^U-[A-Za-z0-9_.-]+$"},"description":{"type":"string","minLength":1},"why_it_matters":{"type":"string","minLength":1},"blocking":{"type":"boolean"},"evidence_state":{"enum":["observed","validated","proposed","unverified","insufficient_evidence"]}}},"decompose":{"type":"object","additionalProperties":false,"required":["visible_groups","meaningful_content","repeated_component_candidates","visual_core","decoration_layers","overlay_connector_candidates","responsive_risks","unknowns","implementation_assumptions_not_allowed_yet"],"properties":{"visible_groups":{"$ref":"#/$defs/string_array"},"meaningful_content":{"$ref":"#/$defs/string_array"},"repeated_component_candidates":{"$ref":"#/$defs/string_array"},"visual_core":{"$ref":"#/$defs/string_array"},"decoration_layers":{"$ref":"#/$defs/string_array"},"overlay_connector_candidates":{"$ref":"#/$defs/string_array"},"responsive_risks":{"$ref":"#/$defs/string_array"},"unknowns":{"type":"array","items":{"$ref":"#/$defs/unknown"}},"implementation_assumptions_not_allowed_yet":{"$ref":"#/$defs/string_array"},"gate_results":{"type":"string"},"allowed_next_stage":{"type":["string","null"]}}},"matrix_row":{"type":"object","additionalProperties":false,"required":["family_id","considered","included_as_candidate","status","reason","evidence_refs"],"properties":{"family_id":{"enum":["A01","A02","A03","A04","A05","A06","A07","A08"]},"considered":{"type":"boolean"},"included_as_candidate":{"type":"boolean"},"status":{"enum":["omission","rejection","approval_gated","risky","viable","not_applicable"]},"reason":{"type":"string","minLength":1},"evidence_refs":{"$ref":"#/$defs/string_array"}}},"ledger_row":{"type":"object","additionalProperties":false,"required":["unknown_id","source_artifact_id","affected_candidates","effect","handling","state","evidence_refs"],"properties":{"unknown_id":{"type":"string"},"source_artifact_id":{"type":"string"},"affected_candidates":{"$ref":"#/$defs/string_array"},"effect":{"type":"string"},"handling":{"enum":["carried","score_capped","blocking","downstream_only","not_applicable","resolved_with_evidence","stale"]},"state":{"enum":["carried","score_capped","blocking","downstream_only","not_applicable","resolved_with_evidence","stale"]},"evidence_refs":{"$ref":"#/$defs/string_array"},"resolving_evidence_refs":{"$ref":"#/$defs/string_array"}}},"candidate":{"type":"object","additionalProperties":false,"required":["candidate_id","family_id","depends_on_unknown_ids","evidence_refs"],"properties":{"candidate_id":{"type":"string"},"family_id":{"type":"string"},"depends_on_unknown_ids":{"$ref":"#/$defs/string_array"},"evidence_refs":{"$ref":"#/$defs/string_array"}}},"architectures":{"type":"object","additionalProperties":false,"required":["stage_2_evidence_digest","architecture_coverage_matrix","unknown_propagation_ledger","active_candidates","rejected_or_approval_gated_candidates","tradeoff_records","hidden_recommendation_self_audit"],"properties":{"stage_2_evidence_digest":{"type":"string"},"architecture_coverage_matrix":{"type":"array","items":{"$ref":"#/$defs/matrix_row"}},"unknown_propagation_ledger":{"type":"array","items":{"$ref":"#/$defs/ledger_row"}},"active_candidates":{"type":"array","items":{"$ref":"#/$defs/candidate"}},"rejected_or_approval_gated_candidates":{"type":"array"},"tradeoff_records":{"type":"array"},"hidden_recommendation_self_audit":{"type":"object"}}},"score":{"type":"object","additionalProperties":false,"required":["candidate_id","criteria","final_total","scores_audited"],"properties":{"candidate_id":{"type":"string"},"criteria":{"type":"array","items":{"type":"object","additionalProperties":false,"required":["criterion_id","value","contract_critical"],"properties":{"criterion_id":{"type":"string"},"value":{"type":["number","string"]},"contract_critical":{"type":"boolean"}}}},"final_total":{"type":["number","null"]},"scores_audited":{"type":"boolean"}}},"score_evidence":{"type":"object","additionalProperties":false,"required":["validated_upstream_artifact_refs","candidate_scores","uncertainty_register","audit_trail_payload","arithmetic_evidence","hidden_recommendation_scan"],"properties":{"validated_upstream_artifact_refs":{"type":"array","items":{"$ref":"#/$defs/source_artifact"}},"candidate_scores":{"type":"array","items":{"$ref":"#/$defs/score"}},"uncertainty_register":{"type":"array"},"audit_trail_payload":{"type":"object"},"arithmetic_evidence":{"type":"object"},"hidden_recommendation_scan":{"type":"object"},"normalization_claim":{"type":"string"},"status":{"type":"string"},"allowed_next_stage":{"type":["string","null"]},"repair_target_stage":{"type":["string","null"]}}},"score_audit":{"type":"object","additionalProperties":false,"required":["validated_stage_4_artifact_ref","input_completeness_audit","schema_and_receipt_audit","candidate_audit_matrix","unknown_discipline_audit","arithmetic_audit","evidence_label_audit","fairness_and_consistency_audit","findings","required_repairs","overall_audit_status","selected_candidate_id","scores_audited","allowed_next_stage"],"properties":{"validated_stage_4_artifact_ref":{"$ref":"#/$defs/source_artifact"},"input_completeness_audit":{"type":"object"},"schema_and_receipt_audit":{"type":"object"},"candidate_audit_matrix":{"type":"array"},"unknown_discipline_audit":{"type":"object"},"arithmetic_audit":{"type":"object"},"evidence_label_audit":{"type":"object"},"fairness_and_consistency_audit":{"type":"object"},"findings":{"type":"array"},"required_repairs":{"type":"array"},"overall_audit_status":{"enum":["pass","fail_missing_input","fail_scoring","insufficient_evidence"]},"selected_candidate_id":{"type":"null"},"scores_audited":{"const":true},"allowed_next_stage":{"type":["string","null"]}}}}}
