{
  "artifact_id": "art-s5",
  "artifact_revision": 1,
  "artifact_schema": "ev4-architect-pipeline-stage-artifact@1.0.0",
  "payload": {
    "allowed_next_stage": "/recommend",
    "arithmetic_audit": {},
    "candidate_audit_matrix": [],
    "evidence_label_audit": {},
    "fairness_and_consistency_audit": {},
    "findings": [],
    "input_completeness_audit": {},
    "overall_audit_status": "pass",
    "required_repairs": [],
    "schema_and_receipt_audit": {},
    "scores_audited": true,
    "selected_candidate_id": null,
    "unknown_discipline_audit": {},
    "validated_stage_4_artifact_ref": {
      "artifact_id": "art-s4",
      "artifact_schema": "ev4-architect-pipeline-stage-artifact@1.0.0",
      "artifact_sha256": "64ba86e85ec10c2a3aa058f91acee68349bf6efe86e19852ce7c85682ebe3e47",
      "source_stage": "/score-evidence",
      "validation_receipt_id": "asb-receipt-art-s4-64ba86e85ec1",
      "validation_status": "valid"
    }
  },
  "run_id": "run-asb-fixture",
  "source_artifacts": [
    {
      "artifact_id": "art-s4",
      "artifact_schema": "ev4-architect-pipeline-stage-artifact@1.0.0",
      "artifact_sha256": "64ba86e85ec10c2a3aa058f91acee68349bf6efe86e19852ce7c85682ebe3e47",
      "source_stage": "/score-evidence",
      "validation_receipt_id": "asb-receipt-art-s4-64ba86e85ec1",
      "validation_status": "valid"
    }
  ],
  "stage_id": "/score-audit",
  "stage_version": "1.0.0"
}
