{
  "artifact_id": "art-s4",
  "artifact_revision": 1,
  "artifact_schema": "ev4-architect-pipeline-stage-artifact@1.0.0",
  "payload": {
    "arithmetic_evidence": {},
    "audit_trail_payload": {},
    "candidate_scores": [
      {
        "candidate_id": "C-A01",
        "criteria": [
          {
            "contract_critical": false,
            "criterion_id": "editability",
            "value": 4
          },
          {
            "contract_critical": true,
            "criterion_id": "responsive_unknown",
            "value": "?"
          }
        ],
        "final_total": null,
        "scores_audited": false
      }
    ],
    "hidden_recommendation_scan": {},
    "uncertainty_register": [
      {
        "unknown_id": "U-1"
      }
    ],
    "validated_upstream_artifact_refs": [
      {
        "artifact_id": "art-s3",
        "artifact_schema": "ev4-architect-pipeline-stage-artifact@1.0.0",
        "artifact_sha256": "1c9951914ab6305c2abc344d8ddb10381d5d39e0329833d2d0bf27051620c051",
        "source_stage": "/architectures",
        "validation_receipt_id": "asb-receipt-art-s3-1c9951914ab6",
        "validation_status": "valid"
      }
    ]
  },
  "run_id": "run-asb-fixture",
  "source_artifacts": [
    {
      "artifact_id": "art-s3",
      "artifact_schema": "ev4-architect-pipeline-stage-artifact@1.0.0",
      "artifact_sha256": "1c9951914ab6305c2abc344d8ddb10381d5d39e0329833d2d0bf27051620c051",
      "source_stage": "/architectures",
      "validation_receipt_id": "asb-receipt-art-s3-1c9951914ab6",
      "validation_status": "valid"
    }
  ],
  "stage_id": "/score-evidence",
  "stage_version": "1.0.0"
}
